{
  "kind": "consistency",
  "logId": "example-log",
  "oldSize": 1,
  "newSize": 2,
  "oldRootHex": "2a158d8afd48e3f88cb4195dfdb2a9e4817d95fa57fd34440d93f9aae5c4f82b",
  "newRootHex": "983cb57c04cddd52634edab38a7bef85708a974f114bbd9aa9ec5d4ce6656b4b",
  "proof": ["e23537b050e84af2cbaab46f2f83d8d3b5febc8e5ac6200d306284f687d46924"]
}
